{
  "contract": {
    "schemaId": "https://schemas.deterministic.solutions/projection/lossless-typescript-ast/1.0.0/schema.json",
    "schemaVersion": "1.0.0",
    "schemaDigest": "sha256:9e8eec601b0b66a31d7c5fac7fd7d478985404dea84c8d34f981b9b41cf31a9e"
  },
  "projectionId": "project-executes-course-authority-conveyor-from-0ce67f6cd9bf94156891d2c861d57e6ed342804e612881497ba0ebbfcbf0c507",
  "targetLanguage": "typescript",
  "artifact": {
    "relativePath": "capabilities/project-course-authority-conveyor/scenarios/execute-the-complete-admitted-conveyor-plan/executes-course-authority-conveyor/executes-course-authority-conveyor.ts"
  },
  "lineage": {
    "featureId": "project-course-authority-through-a-governed-conveyor",
    "scenarioId": "execute-the-complete-admitted-conveyor-plan",
    "obligationId": "execute-one-complete-admitted-conveyor-plan",
    "responsibilityId": "executes-course-authority-conveyor",
    "signalId": "course-authority-conveyor-execution"
  },
  "attestation": {
    "projectorId": "declarative-typescript-body-projector",
    "keyId": "sha256:92efc0c88120a59b8f8ba0f5b252177ee5b260a6eb3e0ce0f23f62119703ab09",
    "algorithm": "ed25519"
  },
  "sourceAst": {
    "profile": "lossless-typescript-ast.v1",
    "posture": "executable",
    "tokens": [
      {
        "kind": "ImportKeyword",
        "text": "import"
      },
      {
        "kind": "WhitespaceTrivia",
        "text": " "
      },
      {
        "kind": "TypeKeyword",
        "text": "type"
      },
      {
        "kind": "WhitespaceTrivia",
        "text": " "
      },
      {
        "kind": "FirstPunctuation",
        "text": "{"
      },
      {
        "kind": "NewLineTrivia",
        "text": "\n"
      },
      {
        "kind": "WhitespaceTrivia",
        "text": "  "
      },
      {
        "kind": "Identifier",
        "text": "CourseConveyorContext"
      },
      {
        "kind": "CommaToken",
        "text": ","
      },
      {
        "kind": "NewLineTrivia",
        "text": "\n"
      },
      {
        "kind": "WhitespaceTrivia",
        "text": "  "
      },
      {
        "kind": "Identifier",
        "text": "CourseConveyorSignal"
      },
      {
        "kind": "NewLineTrivia",
        "text": "\n"
      },
      {
        "kind": "CloseBraceToken",
        "text": "}"
      },
      {
        "kind": "WhitespaceTrivia",
        "text": " "
      },
      {
        "kind": "FromKeyword",
        "text": "from"
      },
      {
        "kind": "WhitespaceTrivia",
        "text": " "
      },
      {
        "kind": "StringLiteral",
        "text": "\"./course-authority-conveyor-execution.type.js\""
      },
      {
        "kind": "SemicolonToken",
        "text": ";"
      },
      {
        "kind": "NewLineTrivia",
        "text": "\n"
      },
      {
        "kind": "NewLineTrivia",
        "text": "\n"
      },
      {
        "kind": "ExportKeyword",
        "text": "export"
      },
      {
        "kind": "WhitespaceTrivia",
        "text": " "
      },
      {
        "kind": "AsyncKeyword",
        "text": "async"
      },
      {
        "kind": "WhitespaceTrivia",
        "text": " "
      },
      {
        "kind": "FunctionKeyword",
        "text": "function"
      },
      {
        "kind": "WhitespaceTrivia",
        "text": " "
      },
      {
        "kind": "Identifier",
        "text": "executesCourseAuthorityConveyor"
      },
      {
        "kind": "OpenParenToken",
        "text": "("
      },
      {
        "kind": "NewLineTrivia",
        "text": "\n"
      },
      {
        "kind": "WhitespaceTrivia",
        "text": "  "
      },
      {
        "kind": "Identifier",
        "text": "context"
      },
      {
        "kind": "ColonToken",
        "text": ":"
      },
      {
        "kind": "WhitespaceTrivia",
        "text": " "
      },
      {
        "kind": "Identifier",
        "text": "CourseConveyorContext"
      },
      {
        "kind": "NewLineTrivia",
        "text": "\n"
      },
      {
        "kind": "CloseParenToken",
        "text": ")"
      },
      {
        "kind": "ColonToken",
        "text": ":"
      },
      {
        "kind": "WhitespaceTrivia",
        "text": " "
      },
      {
        "kind": "Identifier",
        "text": "Promise"
      },
      {
        "kind": "FirstBinaryOperator",
        "text": "<"
      },
      {
        "kind": "Identifier",
        "text": "CourseConveyorSignal"
      },
      {
        "kind": "GreaterThanToken",
        "text": ">"
      },
      {
        "kind": "WhitespaceTrivia",
        "text": " "
      },
      {
        "kind": "FirstPunctuation",
        "text": "{"
      },
      {
        "kind": "NewLineTrivia",
        "text": "\n"
      },
      {
        "kind": "WhitespaceTrivia",
        "text": "  "
      },
      {
        "kind": "ReturnKeyword",
        "text": "return"
      },
      {
        "kind": "WhitespaceTrivia",
        "text": " "
      },
      {
        "kind": "AwaitKeyword",
        "text": "await"
      },
      {
        "kind": "WhitespaceTrivia",
        "text": " "
      },
      {
        "kind": "Identifier",
        "text": "context"
      },
      {
        "kind": "DotToken",
        "text": "."
      },
      {
        "kind": "Identifier",
        "text": "execute"
      },
      {
        "kind": "OpenParenToken",
        "text": "("
      },
      {
        "kind": "Identifier",
        "text": "context"
      },
      {
        "kind": "DotToken",
        "text": "."
      },
      {
        "kind": "Identifier",
        "text": "plan"
      },
      {
        "kind": "CloseParenToken",
        "text": ")"
      },
      {
        "kind": "SemicolonToken",
        "text": ";"
      },
      {
        "kind": "NewLineTrivia",
        "text": "\n"
      },
      {
        "kind": "CloseBraceToken",
        "text": "}"
      },
      {
        "kind": "NewLineTrivia",
        "text": "\n"
      }
    ],
    "topology": [
      {
        "kind": "SourceFile",
        "depth": 0
      },
      {
        "kind": "ImportDeclaration",
        "depth": 1
      },
      {
        "kind": "ImportClause",
        "depth": 2
      },
      {
        "kind": "NamedImports",
        "depth": 3
      },
      {
        "kind": "ImportSpecifier",
        "depth": 4
      },
      {
        "kind": "Identifier",
        "depth": 5
      },
      {
        "kind": "ImportSpecifier",
        "depth": 4
      },
      {
        "kind": "Identifier",
        "depth": 5
      },
      {
        "kind": "StringLiteral",
        "depth": 2
      },
      {
        "kind": "FunctionDeclaration",
        "depth": 1
      },
      {
        "kind": "ExportKeyword",
        "depth": 2
      },
      {
        "kind": "AsyncKeyword",
        "depth": 2
      },
      {
        "kind": "Identifier",
        "depth": 2
      },
      {
        "kind": "Parameter",
        "depth": 2
      },
      {
        "kind": "Identifier",
        "depth": 3
      },
      {
        "kind": "TypeReference",
        "depth": 3
      },
      {
        "kind": "Identifier",
        "depth": 4
      },
      {
        "kind": "TypeReference",
        "depth": 2
      },
      {
        "kind": "Identifier",
        "depth": 3
      },
      {
        "kind": "TypeReference",
        "depth": 3
      },
      {
        "kind": "Identifier",
        "depth": 4
      },
      {
        "kind": "Block",
        "depth": 2
      },
      {
        "kind": "ReturnStatement",
        "depth": 3
      },
      {
        "kind": "AwaitExpression",
        "depth": 4
      },
      {
        "kind": "CallExpression",
        "depth": 5
      },
      {
        "kind": "PropertyAccessExpression",
        "depth": 6
      },
      {
        "kind": "Identifier",
        "depth": 7
      },
      {
        "kind": "Identifier",
        "depth": 7
      },
      {
        "kind": "PropertyAccessExpression",
        "depth": 6
      },
      {
        "kind": "Identifier",
        "depth": 7
      },
      {
        "kind": "Identifier",
        "depth": 7
      },
      {
        "kind": "EndOfFileToken",
        "depth": 1
      }
    ]
  }
}
