{
  "contract": {
    "schemaId": "https://schemas.deterministic.solutions/projection/lossless-typescript-ast/1.0.0/schema.json",
    "schemaVersion": "1.0.0",
    "schemaDigest": "sha256:9e8eec601b0b66a31d7c5fac7fd7d478985404dea84c8d34f981b9b41cf31a9e"
  },
  "projectionId": "project-conformance-parses-generated-body-ast",
  "targetLanguage": "typescript",
  "artifact": {
    "relativePath": "conformance/parses-generated-body-ast.ts"
  },
  "lineage": {
    "featureId": "canonical-feature-authority-course",
    "scenarioId": "project-conformance-parses-generated-body-ast",
    "obligationId": "every-course-code-body-is-projected",
    "responsibilityId": "projects-conformance-parses-generated-body-ast",
    "signalId": "course-code-body-projection-integrity"
  },
  "attestation": {
    "projectorId": "declarative-typescript-body-projector",
    "keyId": "sha256:92efc0c88120a59b8f8ba0f5b252177ee5b260a6eb3e0ce0f23f62119703ab09",
    "algorithm": "ed25519"
  },
  "sourceAst": {
    "profile": "lossless-typescript-ast.v1",
    "posture": "executable",
    "tokens": [
      {
        "kind": "FirstTriviaToken",
        "text": "// Reference stub — not a working implementation."
      },
      {
        "kind": "NewLineTrivia",
        "text": "\n"
      },
      {
        "kind": "FirstTriviaToken",
        "text": "//"
      },
      {
        "kind": "NewLineTrivia",
        "text": "\n"
      },
      {
        "kind": "FirstTriviaToken",
        "text": "// Owns parsing observed source text into the AST shape that"
      },
      {
        "kind": "NewLineTrivia",
        "text": "\n"
      },
      {
        "kind": "FirstTriviaToken",
        "text": "// projects-typescript-ast.json (Layer 17) can be compared against. See"
      },
      {
        "kind": "NewLineTrivia",
        "text": "\n"
      },
      {
        "kind": "FirstTriviaToken",
        "text": "// Canonical Feature Authority File-System Spine.md, Layer 20-21."
      },
      {
        "kind": "NewLineTrivia",
        "text": "\n"
      },
      {
        "kind": "NewLineTrivia",
        "text": "\n"
      },
      {
        "kind": "ExportKeyword",
        "text": "export"
      },
      {
        "kind": "WhitespaceTrivia",
        "text": " "
      },
      {
        "kind": "InterfaceKeyword",
        "text": "interface"
      },
      {
        "kind": "WhitespaceTrivia",
        "text": " "
      },
      {
        "kind": "Identifier",
        "text": "ObservedAst"
      },
      {
        "kind": "WhitespaceTrivia",
        "text": " "
      },
      {
        "kind": "FirstPunctuation",
        "text": "{"
      },
      {
        "kind": "NewLineTrivia",
        "text": "\n"
      },
      {
        "kind": "WhitespaceTrivia",
        "text": "  "
      },
      {
        "kind": "ReadonlyKeyword",
        "text": "readonly"
      },
      {
        "kind": "WhitespaceTrivia",
        "text": " "
      },
      {
        "kind": "Identifier",
        "text": "kind"
      },
      {
        "kind": "ColonToken",
        "text": ":"
      },
      {
        "kind": "WhitespaceTrivia",
        "text": " "
      },
      {
        "kind": "StringKeyword",
        "text": "string"
      },
      {
        "kind": "SemicolonToken",
        "text": ";"
      },
      {
        "kind": "NewLineTrivia",
        "text": "\n"
      },
      {
        "kind": "WhitespaceTrivia",
        "text": "  "
      },
      {
        "kind": "ReadonlyKeyword",
        "text": "readonly"
      },
      {
        "kind": "WhitespaceTrivia",
        "text": " "
      },
      {
        "kind": "OpenBracketToken",
        "text": "["
      },
      {
        "kind": "Identifier",
        "text": "key"
      },
      {
        "kind": "ColonToken",
        "text": ":"
      },
      {
        "kind": "WhitespaceTrivia",
        "text": " "
      },
      {
        "kind": "StringKeyword",
        "text": "string"
      },
      {
        "kind": "CloseBracketToken",
        "text": "]"
      },
      {
        "kind": "ColonToken",
        "text": ":"
      },
      {
        "kind": "WhitespaceTrivia",
        "text": " "
      },
      {
        "kind": "UnknownKeyword",
        "text": "unknown"
      },
      {
        "kind": "SemicolonToken",
        "text": ";"
      },
      {
        "kind": "NewLineTrivia",
        "text": "\n"
      },
      {
        "kind": "CloseBraceToken",
        "text": "}"
      },
      {
        "kind": "NewLineTrivia",
        "text": "\n"
      },
      {
        "kind": "NewLineTrivia",
        "text": "\n"
      },
      {
        "kind": "ExportKeyword",
        "text": "export"
      },
      {
        "kind": "WhitespaceTrivia",
        "text": " "
      },
      {
        "kind": "AsyncKeyword",
        "text": "async"
      },
      {
        "kind": "WhitespaceTrivia",
        "text": " "
      },
      {
        "kind": "FunctionKeyword",
        "text": "function"
      },
      {
        "kind": "WhitespaceTrivia",
        "text": " "
      },
      {
        "kind": "Identifier",
        "text": "parsesGeneratedBodyAst"
      },
      {
        "kind": "OpenParenToken",
        "text": "("
      },
      {
        "kind": "Identifier",
        "text": "source"
      },
      {
        "kind": "ColonToken",
        "text": ":"
      },
      {
        "kind": "WhitespaceTrivia",
        "text": " "
      },
      {
        "kind": "StringKeyword",
        "text": "string"
      },
      {
        "kind": "CloseParenToken",
        "text": ")"
      },
      {
        "kind": "ColonToken",
        "text": ":"
      },
      {
        "kind": "WhitespaceTrivia",
        "text": " "
      },
      {
        "kind": "Identifier",
        "text": "Promise"
      },
      {
        "kind": "FirstBinaryOperator",
        "text": "<"
      },
      {
        "kind": "Identifier",
        "text": "ObservedAst"
      },
      {
        "kind": "GreaterThanToken",
        "text": ">"
      },
      {
        "kind": "WhitespaceTrivia",
        "text": " "
      },
      {
        "kind": "FirstPunctuation",
        "text": "{"
      },
      {
        "kind": "NewLineTrivia",
        "text": "\n"
      },
      {
        "kind": "WhitespaceTrivia",
        "text": "  "
      },
      {
        "kind": "ThrowKeyword",
        "text": "throw"
      },
      {
        "kind": "WhitespaceTrivia",
        "text": " "
      },
      {
        "kind": "NewKeyword",
        "text": "new"
      },
      {
        "kind": "WhitespaceTrivia",
        "text": " "
      },
      {
        "kind": "Identifier",
        "text": "Error"
      },
      {
        "kind": "OpenParenToken",
        "text": "("
      },
      {
        "kind": "NewLineTrivia",
        "text": "\n"
      },
      {
        "kind": "WhitespaceTrivia",
        "text": "    "
      },
      {
        "kind": "StringLiteral",
        "text": "\"parsesGeneratedBodyAst is a documentation stub — see Canonical Feature Authority File-System Spine.md, Layer 20-21\""
      },
      {
        "kind": "NewLineTrivia",
        "text": "\n"
      },
      {
        "kind": "WhitespaceTrivia",
        "text": "  "
      },
      {
        "kind": "CloseParenToken",
        "text": ")"
      },
      {
        "kind": "SemicolonToken",
        "text": ";"
      },
      {
        "kind": "NewLineTrivia",
        "text": "\n"
      },
      {
        "kind": "CloseBraceToken",
        "text": "}"
      },
      {
        "kind": "NewLineTrivia",
        "text": "\n"
      }
    ],
    "topology": [
      {
        "kind": "SourceFile",
        "depth": 0
      },
      {
        "kind": "InterfaceDeclaration",
        "depth": 1
      },
      {
        "kind": "ExportKeyword",
        "depth": 2
      },
      {
        "kind": "Identifier",
        "depth": 2
      },
      {
        "kind": "PropertySignature",
        "depth": 2
      },
      {
        "kind": "ReadonlyKeyword",
        "depth": 3
      },
      {
        "kind": "Identifier",
        "depth": 3
      },
      {
        "kind": "StringKeyword",
        "depth": 3
      },
      {
        "kind": "IndexSignature",
        "depth": 2
      },
      {
        "kind": "ReadonlyKeyword",
        "depth": 3
      },
      {
        "kind": "Parameter",
        "depth": 3
      },
      {
        "kind": "Identifier",
        "depth": 4
      },
      {
        "kind": "StringKeyword",
        "depth": 4
      },
      {
        "kind": "UnknownKeyword",
        "depth": 3
      },
      {
        "kind": "FunctionDeclaration",
        "depth": 1
      },
      {
        "kind": "ExportKeyword",
        "depth": 2
      },
      {
        "kind": "AsyncKeyword",
        "depth": 2
      },
      {
        "kind": "Identifier",
        "depth": 2
      },
      {
        "kind": "Parameter",
        "depth": 2
      },
      {
        "kind": "Identifier",
        "depth": 3
      },
      {
        "kind": "StringKeyword",
        "depth": 3
      },
      {
        "kind": "TypeReference",
        "depth": 2
      },
      {
        "kind": "Identifier",
        "depth": 3
      },
      {
        "kind": "TypeReference",
        "depth": 3
      },
      {
        "kind": "Identifier",
        "depth": 4
      },
      {
        "kind": "Block",
        "depth": 2
      },
      {
        "kind": "ThrowStatement",
        "depth": 3
      },
      {
        "kind": "NewExpression",
        "depth": 4
      },
      {
        "kind": "Identifier",
        "depth": 5
      },
      {
        "kind": "StringLiteral",
        "depth": 5
      },
      {
        "kind": "EndOfFileToken",
        "depth": 1
      }
    ]
  }
}
