{
  "contract": {
    "schemaId": "https://schemas.deterministic.solutions/projection/lossless-typescript-ast/1.0.0/schema.json",
    "schemaVersion": "1.0.0",
    "schemaDigest": "sha256:9e8eec601b0b66a31d7c5fac7fd7d478985404dea84c8d34f981b9b41cf31a9e"
  },
  "projectionId": "project-cli-projects-responsibility-body",
  "targetLanguage": "typescript",
  "artifact": {
    "relativePath": "cli/projects-responsibility-body.ts"
  },
  "lineage": {
    "featureId": "canonical-feature-authority-course",
    "scenarioId": "project-cli-projects-responsibility-body",
    "obligationId": "every-course-code-body-is-projected",
    "responsibilityId": "projects-cli-projects-responsibility-body",
    "signalId": "course-code-body-projection-integrity"
  },
  "attestation": {
    "projectorId": "declarative-typescript-body-projector",
    "keyId": "sha256:92efc0c88120a59b8f8ba0f5b252177ee5b260a6eb3e0ce0f23f62119703ab09",
    "algorithm": "ed25519"
  },
  "sourceAst": {
    "profile": "lossless-typescript-ast.v1",
    "posture": "executable",
    "tokens": [
      {
        "kind": "FirstTriviaToken",
        "text": "// Reference stub — not a working implementation."
      },
      {
        "kind": "NewLineTrivia",
        "text": "\n"
      },
      {
        "kind": "FirstTriviaToken",
        "text": "//"
      },
      {
        "kind": "NewLineTrivia",
        "text": "\n"
      },
      {
        "kind": "FirstTriviaToken",
        "text": "// Owns the `cfa project body --responsibility <id> --target typescript`"
      },
      {
        "kind": "NewLineTrivia",
        "text": "\n"
      },
      {
        "kind": "FirstTriviaToken",
        "text": "// command: running the body-expectation → file-body-authority →"
      },
      {
        "kind": "NewLineTrivia",
        "text": "\n"
      },
      {
        "kind": "FirstTriviaToken",
        "text": "// TypeScript-projection → AST → generated-body pipeline (Spine Layers"
      },
      {
        "kind": "NewLineTrivia",
        "text": "\n"
      },
      {
        "kind": "FirstTriviaToken",
        "text": "// 14-18) for one responsibility. See The Student Experience.md, Section 12."
      },
      {
        "kind": "NewLineTrivia",
        "text": "\n"
      },
      {
        "kind": "NewLineTrivia",
        "text": "\n"
      },
      {
        "kind": "ExportKeyword",
        "text": "export"
      },
      {
        "kind": "WhitespaceTrivia",
        "text": " "
      },
      {
        "kind": "AsyncKeyword",
        "text": "async"
      },
      {
        "kind": "WhitespaceTrivia",
        "text": " "
      },
      {
        "kind": "FunctionKeyword",
        "text": "function"
      },
      {
        "kind": "WhitespaceTrivia",
        "text": " "
      },
      {
        "kind": "Identifier",
        "text": "projectsResponsibilityBody"
      },
      {
        "kind": "OpenParenToken",
        "text": "("
      },
      {
        "kind": "NewLineTrivia",
        "text": "\n"
      },
      {
        "kind": "WhitespaceTrivia",
        "text": "  "
      },
      {
        "kind": "Identifier",
        "text": "responsibilityId"
      },
      {
        "kind": "ColonToken",
        "text": ":"
      },
      {
        "kind": "WhitespaceTrivia",
        "text": " "
      },
      {
        "kind": "StringKeyword",
        "text": "string"
      },
      {
        "kind": "CommaToken",
        "text": ","
      },
      {
        "kind": "NewLineTrivia",
        "text": "\n"
      },
      {
        "kind": "WhitespaceTrivia",
        "text": "  "
      },
      {
        "kind": "Identifier",
        "text": "target"
      },
      {
        "kind": "ColonToken",
        "text": ":"
      },
      {
        "kind": "WhitespaceTrivia",
        "text": " "
      },
      {
        "kind": "StringKeyword",
        "text": "string"
      },
      {
        "kind": "NewLineTrivia",
        "text": "\n"
      },
      {
        "kind": "CloseParenToken",
        "text": ")"
      },
      {
        "kind": "ColonToken",
        "text": ":"
      },
      {
        "kind": "WhitespaceTrivia",
        "text": " "
      },
      {
        "kind": "Identifier",
        "text": "Promise"
      },
      {
        "kind": "FirstBinaryOperator",
        "text": "<"
      },
      {
        "kind": "VoidKeyword",
        "text": "void"
      },
      {
        "kind": "GreaterThanToken",
        "text": ">"
      },
      {
        "kind": "WhitespaceTrivia",
        "text": " "
      },
      {
        "kind": "FirstPunctuation",
        "text": "{"
      },
      {
        "kind": "NewLineTrivia",
        "text": "\n"
      },
      {
        "kind": "WhitespaceTrivia",
        "text": "  "
      },
      {
        "kind": "ThrowKeyword",
        "text": "throw"
      },
      {
        "kind": "WhitespaceTrivia",
        "text": " "
      },
      {
        "kind": "NewKeyword",
        "text": "new"
      },
      {
        "kind": "WhitespaceTrivia",
        "text": " "
      },
      {
        "kind": "Identifier",
        "text": "Error"
      },
      {
        "kind": "OpenParenToken",
        "text": "("
      },
      {
        "kind": "NewLineTrivia",
        "text": "\n"
      },
      {
        "kind": "WhitespaceTrivia",
        "text": "    "
      },
      {
        "kind": "TemplateHead",
        "text": "`projectsResponsibilityBody is a documentation stub — see The Student Experience.md, Section 12 (requested: ${"
      },
      {
        "kind": "Identifier",
        "text": "responsibilityId"
      },
      {
        "kind": "CloseBraceToken",
        "text": "}"
      },
      {
        "kind": "WhitespaceTrivia",
        "text": " "
      },
      {
        "kind": "FirstToken",
        "text": "→"
      },
      {
        "kind": "WhitespaceTrivia",
        "text": " "
      },
      {
        "kind": "Identifier",
        "text": "$"
      },
      {
        "kind": "FirstPunctuation",
        "text": "{"
      },
      {
        "kind": "Identifier",
        "text": "target"
      },
      {
        "kind": "CloseBraceToken",
        "text": "}"
      },
      {
        "kind": "CloseParenToken",
        "text": ")"
      },
      {
        "kind": "FirstTemplateToken",
        "text": "`\n  );\n}\n"
      }
    ],
    "topology": [
      {
        "kind": "SourceFile",
        "depth": 0
      },
      {
        "kind": "FunctionDeclaration",
        "depth": 1
      },
      {
        "kind": "ExportKeyword",
        "depth": 2
      },
      {
        "kind": "AsyncKeyword",
        "depth": 2
      },
      {
        "kind": "Identifier",
        "depth": 2
      },
      {
        "kind": "Parameter",
        "depth": 2
      },
      {
        "kind": "Identifier",
        "depth": 3
      },
      {
        "kind": "StringKeyword",
        "depth": 3
      },
      {
        "kind": "Parameter",
        "depth": 2
      },
      {
        "kind": "Identifier",
        "depth": 3
      },
      {
        "kind": "StringKeyword",
        "depth": 3
      },
      {
        "kind": "TypeReference",
        "depth": 2
      },
      {
        "kind": "Identifier",
        "depth": 3
      },
      {
        "kind": "VoidKeyword",
        "depth": 3
      },
      {
        "kind": "Block",
        "depth": 2
      },
      {
        "kind": "ThrowStatement",
        "depth": 3
      },
      {
        "kind": "NewExpression",
        "depth": 4
      },
      {
        "kind": "Identifier",
        "depth": 5
      },
      {
        "kind": "TemplateExpression",
        "depth": 5
      },
      {
        "kind": "TemplateHead",
        "depth": 6
      },
      {
        "kind": "TemplateSpan",
        "depth": 6
      },
      {
        "kind": "Identifier",
        "depth": 7
      },
      {
        "kind": "TemplateMiddle",
        "depth": 7
      },
      {
        "kind": "TemplateSpan",
        "depth": 6
      },
      {
        "kind": "Identifier",
        "depth": 7
      },
      {
        "kind": "LastTemplateToken",
        "depth": 7
      },
      {
        "kind": "EndOfFileToken",
        "depth": 1
      }
    ]
  }
}
